Шоколад Аленка с миндалем 90г,154.99 
Печенье Коровка топленое молоко,289.97 
Печенье сахарное Традиционное к чаю Любятово 280г,147.67 
Печенье Юбилейное молочное с глазурью 232г,89.99 
Печенье Юбилейное с глазурью 232г,89.99 
Крекер Тук краб 100г,99.79 
Печенье сахарное Классическое клюква Приморский кондитер 400г,139.99 
Печенье сахарное Классическое Приморский кондитер 400г,104.99 
Пирожное Милка двухслойное кусочки шоколада 140г,159.99 
Шоколад Milka молочный шоколад/молочная начинка/печенье 300г,399.99 
Шоколад Alpen Gold клубника/йогурт 85г,109.99 
Шоколад БэбиФокс молочный с молочной начинкой 47г,47.99 
Конфеты Коркунов Коллекция с орехом 110г,324.99 
"Резинка жевательная Дирол кокос/клубника 13,6г",45.99 
Шоколад Alpen Gold молочный соленый миндаль/карамель 80г,109.99 
Батончик Milka Oreo 37г,59.99 
Шоколад Alpen Gold темный с фундуком 80г,79.99 
Батончик Степ MIX вафельный изюм/арахис/карамель 44г,34.99 
Шоколад Alpen Gold темный 80г,79.99 
Зефирные палочки со сгущенным молоком в темной глазури ПК,699.99 
Конфеты Белая черемуха КДВ,249.99 
Конфета Шантарель со вкусом айриш крим КДВ,199.99 
Яйцо пластиковое игрушка/мармелад Конфитрейд 10г,174.99 
Крекер Cheese сыр Kokola 400г,399.99 
Вафельные трубочки Majorico шоколад Kokola 120г,109.99 
Шоколад Бабаевский фундук ОК 100г,149.99 
Шоколад Alpen Gold темный с изюмом и миндалем 80г,109.99 
Шоколад Шокомонстрики с печеньем на палочке 24г,49.98 
Палочки кукурузные Самбери 140г,79.99 
Палочки кукурузные Самбери 90г,54.99 
Печенье Коровка с какао,229.97 
Конфеты Ferrero Collection 109г,379.99 
Кекс с изюмом Денисовы Пекарни 500г,204.99 
Карамель леденцовая Кэнди Лейн кислая вишня 200г,146.76 
Карамель леденцовая Кэнди Лейн лайм и мята 200г,146.76 
Карамель леденцовая Кэнди Лейн клубника/черная смородина 200г,128.89 
Карамель леденцовая Кэнди Лейн гранат 200г,146.76 
Карамель леденцовая Кэнди Лейн клюква 200г,146.76 
Шарики шоколадные Вспыш и Чудо-машинки с 3Д игрушкой 50г,209.99 
Зефир Маршмеллоу Канди мини цветные 200г,169.99 
Шоколад KitKat Senses Gold 112г,199.99 
Конфеты Сгущенка с кокосом в шоколадной глазури,599.99 
Конфеты Вареная сгущенка с кокосом в шоколадной глазури,599.99 
Конфеты Лакки Чакки микс Коммунарка,249.99 
Мармелад жевательный Бон Пари Кошмарики 75г,99.99 
Мармелад жевательный Бон Пари Единорожка 100г,149.99 
Карамель Funny Boom мини микс с начинкой 120г,48.99 
Батончик злаковый Nesquik Duo 23г,64.87 
Конфеты Дыня в шоколадной глазури 200г,249.99 
Мармелад Бон Пари Машины 75г,99.99 
Маффины Самбери ванильные с вареной сгущенкой 450г,169.99 
Карамель Бон Пари Капучино Фундук 65г,54.99 
Мармелад жевательный Бон Пари Фламинго 100г,149.99 
Батончик KitKat Senses Gold Duo 58г,89.99 
Мармелад жевательный Bebeto Fast Food 25г,44.99 
Шоколад молочный Milka клубничный чизкейк 300г,399.99 
Мармелад жевательный Bebeto лимон/клубника/апельсин 70г,84.99 
Мармелад жевательный Bebeto Peach Rings вкус персика 70г,84.99 
Суфле Маршмеллоу Bebeto вкусом арбуза 60г,84.99 
Суфле Маршмеллоу Bebeto Cola сo вкусом колы 30г,49.99 
Суфле Маршмеллоу Bebeto ваниль/клубника 30г,49.99 
Пирожное бисквитное Fudo шоколад 18г,24.99 
Пирожное бисквитное Fudo банан 18г,24.99 
Батончик Двойная радость печенье/карамель 50г,37.87 
Шоколад Schogetten молочно-ванильный крем/печенье/какао 100г,98.87 
Конфеты Звездный дождь РотФронт,219.99 
Печенье Рогалик с черносливом Вешки-Свит 400г,209.98 
Пахлава Арабская Вешки-Свит 450г,209.98 
Пахлава Чешская Вешки-Свит 500г,234.87 
Печенье Колосок с маковой начинкой Вешки-Свит 450г,259.97 
Шоколад Приморский кондитер темный с морской солью 15г,39.99 
Шоколад Alpen Gold МаксФан имбирь/арахис/корица 150г,146.96 
Пастила фруктовая ассорти 1шт,14.99 
Мармелад Свитбокс с игрушкой Леди Баг 10г,199.99 
Мармелад Свитбокс с игрушкой 44 Котенка 10г,199.99 
Шоколадные шарики Буба с игрушкой 50г,150 
Шоколад Риттер Спорт темный миндаль/апельсин 100г,139.99 
Шоколад Бабаевский мандарин и грецкий орех 100г,149.99 
Зефир Вдохновение грушевый десерт в темном шоколаде 245г,384.99 
Конфеты Merci шоколадный мусс 210г,239.99 
Шоколад Волшебные краски Волшебница 100г,129.99 
Конфеты Приморские классические Приморский кондитер 270г,299.99 
Зефир Ванильный в шоколадной глазури 340г,149.99 
Торт вафельный Бабаевская Белочка ореховый 250г,199.99 
Печенье Oreo начинка со вкусом клубники 228г,169.67 
Нуга Столичные штучки сорехами и цукатами 60г,42.99 
Шоколадно-молочная паста Gusto Pasta 350г,219.98 
Бисквит Choco Pie Cherry Orion 12шт 360г,249.99 
Конфеты зефирные Haribo Шамеллоус Барбекю 90г,119.87 
Шоколад Аленка с фундуком и изюмом 90г,119.99 
Шоколад Alpen Gold молочный с дробленым фундуком 85г,109.99 
Шоколад Alpen Gold молочный фундук/изюм 85г,109.99 
Шоколад Alpen Gold молочный черника/йогурт 85г,109.99 
Шоколад Alpen Gold молочный соленый арахис/крекер 85г,109.99 
Шоколад Alpen Gold молочный арахис/кукурузные хлопья 85г,109.99 
Шоколад Alpen Gold молочный 85г,109.99 
Шоколад Alpen Gold МаксФан молочная карамель/мармелад/печенье 150г,214.99 
Печенье Юбилейное светлая глазурь 121г,69.69 
Конфеты Чернослив шоколадный Кремлина,399.99 
Конфеты Манго шоколадное Кремлина,799.99 
Конфеты Курага шоколадная Кремлина,649.99 
Конфеты Инжир шоколадный Кремлина,399.99 
Конфеты Апельсин шоколадный Кремлина,799.99 
"Жевательная резинка Ментос пур фреш Виноград 15,5г",44.99 
Пастила Ванильная Сладком 350г,107.99 
Пастила в кокосе Сладком 350г,107.99 
Вафли Milka какао 30г,49.97 
Печенье Milka с овсяными хлопьями 42г,49.97 
Шоколад Ritter Sport молочный кокосовое пирожное 100г,129.89 
Мармелад жевательный Маяма желейная начинка малина и черная смородина КДВ,309.99 
Торт Чизкейк Ассорти Новоторг 700г,1099.98 
Печенье O&T клубника 120г,144.97 
Капкейк Игрушка 260г,237.97 
Зефир Белуччи ванильный КДВ 260г,129.99 
Зефир Денисовы Пекарни Бабл Гам на агаре 340г,144.99 
Шоколадная паста Bombbar с фундуком 150г,339.98 
Паста арахисовая Bombbar натуральная хрустящая 300г,429.98 
Паста арахисовая Bombbar натуральная 300г,429.98 
Вафли Всегда добрый день со вкусом шоколада 200г,69.99 
Вафли Всегда добрый день со вкусом сгущенного молока 200г,69.99 
Вафли Всегда добрый день со сливочным вкусом 200г,69.99 
Вафли Всегда добрый день со вкусом шоколада 500г,139.99 
Пряник Самбери мятный 400г,99.99 
"Батончик Nesquik молочная начинка 20,5г",29.99 
Печенье сахарное Савоярди Форно Бонами 200г,169.98 
Конфеты Птичье молоко Зея 300г,279.99 
Резинка жевательная Корис Фруктовое ассорти 38г,169.99 
"Резинка жевательная Marukawa Крейзи Фиш ассорти 4 вкуса 12,6г",55.97 
Пирожное Choco Pie Смородина Orion 360г,249.99 
Пирожное Choco Pie Манго Orion 360г,249.99 
Яйцо шоколадное Монстры на каникулах 3 20г,77.89 
Конфеты Звонкое лето желейные вкус абрикоса,199.99 
Конфеты Матрёшка с ореховым вкусом,449.99 
Резинка жевательная Mentos PURE FRESH Арбуз 54г,199.99 
Резинка жевательная Mentos PURE FRESH виноград 54г,199.99 
Леденцы Холлс кола 25г,47.99 
Шоколад Alpen Gold горький 80г,79.99 
Шоколад Alpen Gold МаксФан ягоды/рисовые шарики/карамель 150г,214.99 
Шоколад Alpen Gold МаксФан фрукты/рисовые шарики/карамель 150г,189.99 
Шоколад Золотая марка карамель/арахис 92г,259.99 
Шоколад Alpen Gold белый миндаль/кокосовая стружка 85г,109.99 
Шоколад Alpen Gold МаксФан мармелад/кола/попкорн/карамель 150г,189.99 
Батончик Твикс Соленая карамель 55г,59.99 
Резинка жевательная Дирол Икс Фреш Арбузный лед 64г,189.99 
Конфеты Золотая марка карамель/арахис 184г,529.99 
Печенье OREO праздничное Вкус Веселья 176г,169.67 
Печенье O&T яблоко 120г,144.97 
Печенье O&T кофе 105г,129.97 
Печенье O&T черника 120г,144.97 
Печенье O&T лимон 105г,129.97 
"Резинка жевательная Dirol уголь/мята 13,6г",45.99 
Карамель на палочке Lolly Box для мальчиков 50г,154.99 
Мармелад жевательный Haribo Червячки Вуммис 80г,63.76 
Мармелад жевательный Haribo Червячки Вуммис 155г,107.76 
Мармелад жевательный Haribo Золотые мишки 80г,63.76 
Карамель на палочке Lolly Box Любимые Герои 40г,154.99 
Мармелад жевательный Haribo Золотые мишки 155г,107.76 
Мармелад жевательный Haribo Хэппи кола 80г,63.76 
Яйцо Fruitls Maxi мармелад Конфитрейд 10г,239.99 
Яйцо Fruitls Toy мармелад Конфитрейд 10г,119.99 
Мармелад Свитбокс Буба Конфитрейд 10г,219.99 
Конфеты Глэйс со сливочным вкусом КДВ,299.99 
Мармелад Свитбокс Микс Конфитрейд 10г,219.99 
Конфеты Raffaello с миндальным орехом 70г,189.99 
Шоколад Приморский кондитер темный мята/какао 100г,134.99 
Вафли Любимые со сливками,367.78 
Конфеты Птичье молоко Зея 200г,239.99 
Шоколад Приморский ванильно-лимонный 100г,124.99 
Печенье Творожное Аквариум 250г,134.67 
Печенье сахарное/сбивная начинка Ассорти КФ Сибирь 900г,309.87 
Хворост Лисички Денисовы Пекарни 190г,187.88 
Трубочки вафельные с вареной сгущенкой 700г,339.88 
Печенье Чокочип с кусочками темного шоколада 120г,159.99 
Бисквит Чоко Пай Чокочип апельсин и шоколад 6шт,137.68 
Жевательный мармелад Конфитрейд Ми-Ми-Мишки Vitafruit 65г,84.99 
Шоколадные чипсы 24 Chocola’s Crispy Cacao 80г,150 
Яйцо шоколадное Шоки-Токи для девочек с игрушкой 20г,109.99 
"Конфеты Halls цитрусовый пунш 12,5г",59.99 
Мармелад Свитбокс Сказочные зверята с игрушкой 5г,219.99 
Десерт Кидсбокс Премьер с подарком 20г Конфитрейд,109.99 
"Яйцо DISNEY FRUITLES в ассортименте 12,5г Конфитрейд",89.99 
Конфеты Belucci с шоколадным вкусом КДВ,399.99 
Конфеты Belucci с лимонным вкусом КДВ групп,269.99 
Печенье Мария Всегда добрый день 500г,109.99 
Крекер Стайка рыбок Всегда добрый день 200г,54.99 
Пряники Клюква Ветли 350г,107.96 
Шоколад Приморский кондитер темный кайенский перец/соленый миндаль 100г,124.99 
Шоколадный батончик Snickers Stick 20г,34.99 
Шоколад Приморский кондитер ламинария и морской еж 100г,159.99 
Шоколад Приморский кондитер с морским гребешком 100г,179.99 
Мармелад Фруттелла Молочные коровки 138г,129.99 
Мармелад Фруттелла Йогуртовые Червячки 138г,129.99 
Конфеты Лунные дольки микс помадные неглазированные 250г,129.99 
"Конфеты Fruit Sticks чернослив,грецкий орех и изюм 175г",299.99 
Конфеты Кедровая комета классическая 120г,297.89 
Конфеты Кедровая комета с сосновой шишкой 120г,297.89 
Конфеты ПоДАрИ трюфель печенье макарон/малина 160г,239.79 
Резинка жевательная Juicy Fruit Фруктовый Микс Minis 14г,41.99 
Конфеты жевательные Мамба Волшебный твист 150г,169.99 
Драже жевательное Ментос Кола 37г,84.99 
Драже Миндаль в шоколаде Алмонд Чокоболс Lotte 42г,84.87 
Пастила со вкусом апельсина СЕ-КА 85г,99.99 
Пастила со вкусом абрикоса СЕ-КА 85г,99.99 
Пастила со вкусом граната СЕ-КА 85г,99.99 
Палочки кукурузные сладкие 50г,29.89 
Зефир Черничная поляна с ягодами черники 310г,143.89 
Конфеты Пралиновые 250г ПК,179.99 
Печенье затяжное сэндвич клубничный КДВ,299.89 
Печенье затяжное сэндвич сливочный КДВ,299.89 
Печенье Демидовское с цукатами 350г,139.99 
Вафли с карамелью глазированные КДВ,579.79 
Пирожное Медвежонок Барни малина-кокос 150г,149.98 
Вафли КДВ сливочные,314.89 
Конфеты Milka с ореховой начинкой 110г,249.99 
Конфеты Milka с молочной начинкой 110г,249.99 
Конфеты Yoyo желейные ассорти 80г,179.99 
Карамель Раковые шейки 250г Красный Октябрь,169.99 
Пряник Шоколадный Самбери 400г,99.99 
Пирожное Язык слоеный Чашка Чая 64г,32.98 
Конфеты Merci ассорти Подарок 200г,199.99 
Печенье Золотое решето сахарное 200г Алешина,69.98 
Пряник Тульский смородина 140г,49.99 
Пряник Тульский апельсин и корица 140г,69.98 
Печенье сдобное Палочка с изюмом 700г,224.96 
Печенье Ушки слоеные Денисовы Пекарни 450г,174.88 
Крекер Гутэ Орион 72г,99.79 
Печенье сдобное Валентинки 430г,227.99 
Пирожное с шоколадной начинкой 30г КДВ,18.97 
Вафли с вишневым джемом 40г КДВ,26.97 
Батончик Snickers Crisper 60г,71.99 
Батончик ФИ Крупской шоколадная начинка 50г Славянка,39.99 
Бисквит Аленка шоколадный крем 200г,194.89 
"Шоколад Аленка с гранолой, фундуком и изюмом 90г",154.99 
Шоколад Золотая марка дуэт с фундуком 85г,169.99 
"Шоколад M&M's молочный,фундук и драже 122г",214.99 
Шоколад M&M's молочный миндаль/драже 122г,214.99 
Шоколад M&M's молочный c драже 125г,214.99 
Крекер Butter кофе с молоком 70г,59.99 
Карамель Anytime Plum & Peach Лотте 74г,96.87 
Конфеты с игрушкой вентилятор Щенячий Патруль,359.99 
Крекер Французский Всегда Добрый день 210г,59.99 
Печенье затяжное Мария Всегда Добрый день 230г,59.99 
Шоколадная паста Bounty 200г,299.87 
Пирожное Топленое молоко суфле Хлебный дом 110г,74.97 
Конфеты Киви в бело-темной шоколадной глазури Микаелло,499.99 
Десерт Степ с печеньем Славянка,229.99 
Конфеты Несквик Нестле,1149.99 
Конфеты Фараделла Акконд,449.99 
Конфеты Коровка в глазури Вольский кондитер,549.99 
Конфеты Глейс с шоколадным вкусом КДВ,299.99 
Конфеты Джетс с печеньем КДВ,249.99 
Конфета Трицветик ассорти Сибирь,349.99 
Конфеты желейные Савинов микс,199.99 
Конфеты Отломи Акконд,599.99 
Конфеты Джоли-рэй микс Акконд,399.99 
Конфеты Бонифати клубника Акконд,549.99 
Карамель шипучки Жили Были Богатырь,199.99 
Карамель леденцовая Пчёлка микс Би-энд-Би,299.99 
Конфеты Фруззи Дуо микс Би-энд-Би,349.99 
Конфеты Трюфели с ромом 180г Победа,169.89 
"Резинка жевательная Ментос Pure White клубника 15,5г",44.99 
Конфета-гель Кислая Атака 45г,97.99 
Конфеты Васильки,549.99 
Печенье Юбилейное злаковое с яблоком 171г,139.78 
Печенье Юбилейное злаковое 171г,139.78 
Бисквит Аленка 200г,169.99 
Бисквит Аленка вареная сгущенка 200г,139.99 
Батончик Финиковый с арахисом 42г,39.89 
Шоколад Риттер спорт темный 74% какао 100г,149.99 
Батончик злаковый Fitness банан 24г,64.87 
Шоколад Риттер спорт темный 61% какао 100г,149.99 
Шоколад Milka Chips Ahoy молочный 100г,119.99 
Шоколад Milka Raspberry Cream молочный 100г,119.99 
Шоколад Риттер спорт молочный 55% какао 100г,149.99 
Мармелад жевательный Чупа-Чупс Мини трубочки 70г Ван Мелле,114.99 
Шоколад Milka White Chocolate 100г,119.99 
Мармелад Апельсиновый в темном шоколаде 175г Милано,196.67 
Мармелад ассорти глазированный 225г КФ Нева,89.99 
Конфеты Золотой Степ арахис и карамель 192г,119.87 
Конфеты КитКат темные 169г,259.99 
Конфеты КитКат молочные 169г,259.99 
Конфеты Какао-помадные 250г ПК,154.99 
Конфеты United кофейные 140г,159.99 
Пирожное OH YES 280г,329.99 
"Конфеты Halls мини мята 12,5г Мон делиз",59.99 
Мармелад Чупа Чупс Кислые фансы 150г,179.99 
Карамель Чупа Чупс тропический 15г,49.99 
Шоколадное яйцо Шоки-Токи Для Мальчиков с игрушкой 20г,109.99 
Пастилки Свитбокс DISNEY ТАЧКИ FRUITLES с игрушкой 5г,199.99 
Десерт Кидсбокс для мальчиков с подарком 20г,109.99 
Конфеты Nesquik мини 171г,249.99 
Пирожное Медвежонок Барни сэндвич темный шоколад 180г,150.99 
Пирожное Блинное 90г КФХ,97.97 
Пирожное Оригинальное Мерси 400г,197.99 
Печенье Сказка Оленёнок Рот-Фронт,239.98 
Печенье Любятово Мюсли яблоко и корица 120г,167.79 
Бисквит Dream Cake какао 6шт Лотте,169.89 
Бисквит Dream Cake крем 6шт Лотте,169.89 
Конфеты United cливочный шотландский скотч 140г,159.99 
Конфеты 1 2 3 Za! MIX 330г,389.99 
Карамель Клубника со сливками Бабаевский,219.99 
Пирог Бейкер Хаус морковный 350г,224.96 
Печенье-сэндвич FORSITE шоколадно-сливочный вкус 208г,79.96 
Печенье-сэндвич TONDI шоколадный вкус 182г,77.96 
Печенье-сэндвич TONDI шоколадно-сливочный вкус 182г,77.96 
Печенье Twix top 21г Марс,37.87 
Печенье-сэндвич FORSITE кокос 208г,79.96 
Печенье-сэндвич FORSITE шоколадно-ореховый вкус 208г,79.96 
Крекер Яшкино с сыром 135г,57.89 
Крекер Классический КДВ 350г,122.99 
Крекер Яшкино с солью КДВ 125г,49.98 
Батончик Джетс карамель с печеньем 42г КДВ,22.99 
Шоколад O'Zera Dark&Extra апельсин 40г КДВ,65.99 
Шоколад O'Zera Dark&Red ягоды 40г КДВ,65.99 
Батончик вафельный Зебра с молочной шоколадной глазурью 40г КДВ,29.99 
Батончик вафельный Джумка с воздушной кукурузой 37г КДВ,29.99 
"Шоколад Степ арахис,карамель 100г",59.99 
Шоколад Белочка горький с цельным миндалем 100г,144.99 
Печенье Чоко-бой карамель 45г,67.99 
Крекер ТUC МИНИ сыр 100г,109.89 
Шоколад Золотая марка дуэт белый карамельный с печеньем 85г,169.99 
Резинка жевательная Mentos PURE WHITE нежная мята 54г,199.99 
Резинка жевательная Дирол Икс Фреш вкус мандарина 16г,54.99 
Конфеты Мишка на севере 200г КФК ГОСТ,169.99 
Мармелад Свитбокс Enchantimals с игрушкой 10г,219.99 
Десерт Кидсбокс Для Девочек с подарком 20г,109.99 
Конфеты Хэппи Бокс с игрушкой Три кота 18г,209.99 
Шоколад Белочка молочный с цельным фундуком 100г,129.99 
