Огурцы малосольные Монастырские бочковые МеленЪ 900г,179.98
Свинина тушеная высший сорт ГОСТ МКК Балтийский 325г,219.98
Оливки без косточки Iberica 300г,229.98
Икра из запеченного лука с вялеными томатами 250г,179.98
Икра из запеченных грибов с вялеными томатами Tomtom 250г,229.98
Капоната запеченные баклажаны/вяленые томаты Tomtom 250г,199.98
Салат с тунцом/кукуруза/овощи Fortuna 160г,219.98
Каша перловая с говядиной ТУ Орск 340г,79.98
Маслины Iberica крупные с косточкой 420г,246.98
Шампиньоны отборные резаные Самбери 850мл,199.69
Судак с лесной клюквой и шампиньонами Медовый дом 250г,399.89
Суп гороховый с мясом Рузком 540г,109.98
Оливки с семгой Maestro de Oliva 300г,189.99
Фасоль печеная со сладким перцем Bonduelle 350мл,169.98
Оливки красные гигант Bella Contadina 290г,329.98
Оливки без косточек Maestro de Oliva 300г,179.98
Оливки  ночеллара Bella Contadina 290г,329.98
Томаты маринованные Дядя Ваня 680г,149.98
Суп харчо с мясом Рузком 540г,109.98
Груша половинки Всегда Добрый День 425мл,109.99
Грибы Маслята маринованные Mikado 580мл,319.98
Энсалада запеченные огурцы/вяленые томаты Tomtom 250г,199.98
Сардина иваси натуральная Примрыбснаб 250г,76.98
Фасоль белая Прованская Фрау Марта 310г,106.98
Печень минтая Рыблевка Камчатка 250г,149.98
Компот лонган SeiYo 580мл,199.97
Оливки с паприкой Iberica 70г,189.98
Килька обжаренная в томатном соусе Вкусные Консервы 240г,99.98
Капуста соленая Чили Арсеньевское Подворье 500г,199.99
Тунец рубленый в масле Фортуна Мистраль 185г,199.98
Тунец в собственном соку Iberica 160г,289.98
Рузком Горох с копченостями 325г,66.98
Имбирь маринованый 150г КНР,49.99
Буженина Класcическая Главпродукт 325г,259.98
Каша рисовая с говядиной Бурятмясопром 340г,119.98
Каша гречневая с говядиной Орский МК 340г,79.98
Паштет из тунца Setra 80г,169.98
Икра из баклажанов Угощение Славянки 545г,159.98
Салат ДВ с кальмаром Всегда Добрый день 220г,59.99
Маслины с косточкой Delphi 420г,279.98
Грибы Маслята маринованные Микадо 314мл,166.98
Томаты вяленые по-Французски Brand Oil 250г,229.98
Кукуруза Globus 340г,129.98
Икра баклажанная Пиканта 520г,169.98
Оливки с чесноком и тимьяном Iberica 70г,189.98
Перчики Французские яблочки Дядя Ваня 680г,196.98
Грибное лукошко отборные Скатерть самобранка 580мл,259.98
Компот папайа красная SeiYo 425мл,197.98
Кимчи из огурцов Угай 300г,139.99
Горошек Globus 400г,119.98
Каша рисовая с говядиной Орский МК 340г,79.98
Фасоль белая в томатном соусе Globus 425мл,119.98
Иваси сардина копченая в масле Доброфлот 210г,119.98
Огурчики соленые Globus 950мл,219.98
Печень минтая по-приморски Примрыбснаб 240г,49.99
Корюшка в томатном соусе Хозяин Балтики 230г,49.98
Оливки с косточкой Iberica 300г,189.98
Маслины супергигант Maestro de Oliva 425г,399.98
Крылышки куриные гриль Главпродукт 300г,199.98
Фасоль печеная в аджике Пиканта 530г,189.98
Говядина отварная с бульоном ГОСТ Сила 338г,199.98
Томаты мелконарезанные Mutti 400г,176.98
Салат Кимчи острый Koyori 300г,179.99
Маслины без косточки Bonduelle 314г,179.98
Томаты сушеные в подсолнечном масле Delphi 340г,419.98
Фасоль красная Heinz 400г,179.98
Овощи печеные Noyan 560г,229.98
Иваси сардина натуральная Делатика 245г,68.98
Помидоры соленые бочковые,179.99
Каперсы Греция 105г,269.98
Вяленые томаты дольки Tomtom 100г,169.98
Лечо Закарпатское Дядя Ваня 680г,159.98
Огурцы маринованные Меленковские с зеленью и чесноком МеленЪ 950мл,169.98
Кабачки маринованные оригинальные Агрокомплекс 720г,179.98
Томаты зелень/острый перец Спасский 680г,109.98
Маслины без косточки в оливковом масле Iberica chica 90г,169.98
Маслины без косточек Iberica chica 200г,189.98
Грибы ассорти маринованные Деликон 530г,229.98
Тунец филе в собственном соку Фортуна 185г,249.98
Компот гуава SeiYo 425мл,197.98
Икра из баклажанов запеченных на гриле Bonduelle 530г,239.98
Икра из молодых кабачков Ресторация Обломов 420г,156.98
Лечо Пиканта 520г,149.98
Паштет из семечек томат - базилик 200г Полезные Продукты,169.99
Компот тропический SeiYo 580мл,197.98
Печень говяжья в собственном соку Стандарт Курганский 325г,149.98
Оливки без косточки Всегда Добрый День 300мл,75.98
Грибы Шампиньоны острые КНР 250г,119.99
Борщ со свежей капустой ГОСТ Барко 500г,99.98
Говядина тушеная высший сорт Главпродукт 525г,269.98
Фасоль белая в собственном соку Heinz 400мл,196.98
Брускетта запеченные оливки/прованские травы Tomtom 140г,229.98
Тунец филе в собственном соку Ультрамарин 120г,149.98
Салат Дальневосточный морская капуста Сакура 220г,59.98
Икра баклажановая ГОСТ Фрау Марта 320г,126.98
Помидоры соленые Соленья ДВ,199.99
Фасоль белая оригинальная Фрау Марта 310г,89.98
Грибы КНР 280г,79.99
Паштет из семечек с грибами 200г Полезные Продукты,169.99
Брускетта вяленые томаты/кешью Tomtom 140г,229.98
Иваси сардина натуральная Всегда Добрый День 245г,74.99
Кукуруза Фрау Марта 310г,79.98
Папоротник соленый Кур-Восток-Урми,199.99
Морковка по-корейски Лукашинские 340г,109.98
Маслины Охибланка Bonduelle 314мл,219.98
Печень минтая по-приморски Рыбспецпром 170г,109.98
Перец острый маринованный 100г КНР,79.99
Капуста Кимчи КФХ Федорович 500г,179.99
Компот Лютик Мандарины 314мл,139.89
Кукуруза Bonduelle молодая 212мл,99.98
Маслины без косточек ITLV 314мл,146.98
Имамбаялды (жаренные овощи) Noyan 560 г,249.98
Фасоль белая в собственном соку Самбери 425мл,99.99
Томаты маринованные красные/бурые Gustus 680г,149.98
Оливки с огурчиком Maestro de Oliva 300г,329.98
Закуска из фасоли жареные бобы 200г Senor Bob,99.99
Огурцы маринованные Самбери 720мл,229.99
Шпроты в масле Экстра Вкусные консервы 250г,149.98
Персики половинки Всегда Добрый день 425мл,107.99
Томаты маринованные деликатесные Gustus 680г,149.98
Икра из кабачков Кубаночка 500г,84.98
Рассольник с солеными огурцами ГОСТ Барко 500г,99.98
Капуста квашеная КФХ Федорович 500г,129.99
Шпроты в масле Барко 160г,99.98
Икра из кабачков Скатерть Самобранка 370мл,129.98
Тунец натуральный рубленый в собственном соку Фортуна 185г,199.98
Персики половинки Всегда Добрый День 850мл,199.99
Курица филе грудки для салатов Сила 350г,169.98
Ветчина Домашняя Главпродукт 325г,219.98
Кимчи из лобы Кактуги Угай 300г,139.99
Оливки без косточки ITLV 314мл,156.98
Тунец кусочки в масле Самбери 185г,177.79
Икра кабачковая Пиканта 520г,149.98
Закуска классическая Фава 200г Полезные Продукты,99.99
Компот Клубника в сиропе Всегда Добрый день 425мл,114.99
Капуста Пекинская Кимчи Соленья ДВ,349.99
Кукуруза Bonduelle 212мл,78.98
Компот манго SeiYo 425мл,169.96
Горошек зеленый Хайнц 400г,156.98
Лоба маринованная КФХ Федорович 250г,79.99
Тунец натуральный Хозяин морей 230г,89.88
Фасоль красная Globus 425мл,119.98
Огурцы маринованные Noyan 920г,229.98
Кукуруза сладкая Heinz 340г,156.98
Ветчина К Завтраку 325г,109.98
Килька обжаренная в томатном соусе Крымское Золото 240г,86.98
Мясо кур в собственном соку ГОСТ Мясной завод Алтая 350г,119.98
Тефтели рыбные в томатном соусе Делатика 240г,66.98
Огурцы соленые Соленья ДВ 600г,159.99
Капуста Кимчи пекинская Хан О.Ю 500г,199.99
Маслины без косточки Iberica крупные 420г,246.98
Оливки c красным перцем Iberica 70г,189.98
Маслины с косточкой Iberica мини 300г,199.98
Капуста квашеная Соленья ДВ 400г,119.99
Закуска по-Тоскански Дядя Ваня 460г,146.98
Фасоль красная в собственном соку Самбери 425мл,99.99
Кукуруза Всегда Добрый день 425мл,64.99
Завтрак туриста Рузком 325г,99.98
Огурцы соленые целые Gustus 680г,179.98
Семга натуральная Хозяин Балтики 240г,79.98
Ассорти печень/икра минтая Рыбспецпром 170г,99.98
Свинина тушеная высший сорт ГОСТ БКК 338г,139.98
Закуска из чечевицы острая 200г Полезные Продукты,169.99
Оливки зеленые фаршированные с перцем La Rambla 235г,299.98
Каперсы Iberica 100г,196.98
Горошек Bonduelle 425мл,123.98
Свинина тушеная ГОСТ Мясной завод Алтая 338г,119.67
Томаты вяленые по-Итальянски Brand Oil 250г,229.98
Томаты без кожуры La Torrente 400г,179.98
Печень минтая натуральная Камчаттралфлот 120г,219.98
Грибы Вешенки маринованные КФХ Федорович 250г,149.99
Салат морская капуста Любительский Делатика 220г,64.98
Икра кабачкова Noyan 530г,229.98
Капуста квашеная КФХ Федорович 1кг,249.99
Микс фруктов Всегда Добрый День 425мл,129.99
Маслины без косточки Iberica мини 300г,229.98
Икра из молодых баклажанов Ресторация Обломов 420г,156.98
Фасоль красная в томатном соусе Фрау Марта 310г,89.98
Кукуруза Bonduelle 425мл,125.98
Килька с овощами по-мексикански За Родину 240г,87.98
Скумбрия атлантическая натуральная с добавлением масла Делатика 245г,79.98
Тунец филе в собственном соку Самбери 185г,189.96
Грибы опята маринованные Скатерть самобранка 580мл,319.98
Индейка филе ГОСТ 325г,149.98
Сардина иваси натуральная с добавлением масла Примрыбснаб 250г,76.98
Конина тушеная высший сорт ГОСТ БКК 338г,179.98
Закуска из чечевицы 200г Полезные Продукты,169.99
Килька балтийская в томатном соусе Барко 240г,79.98
Тунец рубленый в масле Самбери 185г,154.79
Кукуруза Bonduelle молодая 425мл,139.98
Кукуруза Всегда Добрый день 212мл,44.99
Печень минтая по-приморски Делатика 230г,69.98
Баклажаны в аджике Пиканта 520г,199.98
Горошек Bonduelle 212мл,75.98
Сайра тихоокеанская натуральная с добавлением масла Доброфлот 245г,229.98
Горошек Bonduelle молодой 425мл,139.98
Говядина тушеная ГОСТ Бурятмясопром 338г,189.98
Капуста Кимчи пекинская Угай 300г,139.99
Огурцы маринованные целые Gustus 680г,179.98
Кукурузные початки SeiYo 425мл,159.96
Овощное блюдо Рататуй Пиканта 520г,159.98
Капуста Пекинская Кимчи 500г,199.99
Горошек Фрау Марта зеленый консервированный ГОСТ 310г,89.99
Закусочка Венгерская Дядя Ваня 460г,146.98
Ассорти овощное маринованное Дядя Ваня 1800г,299.98
Фасоль красная Лобио по-грузински Фрау Марта 310г,106.98
Оленина тушеная ВС ГОСТ Мясной завод Алтая 338г,198.98
Горошек зеленый Кубаночка 460г,89.98
Паста из артишоков Pucci 156мл,229.98
Оливки анчоус/вермут Maestro de Oliva 300г,229.98
Горошек зеленый молодой Bonduelle 212мл,89.98
Салат ДВ из морской капусты Всегда Добрый день 220г,39.99
Фасоль по-домашнему с грибами Пиканта 530г,189.98
Икра кабачковая Нежная Лукашинские 460г,129.98
Шампиньоны целые отборные Самбери 425мл,119.99
Свинина тушеная высший сорт ГОСТ Семейный бюджет 500г,199.98
Говядина тушеная ГОСТ Мяспром 325г,109.98
Говядина тушеная в собственном соку БКК 350г,219.98
Шпроты в масле Старая Рига 190г,159.98
Шпроты в масле Главпродукт 160г,114.99
"Говядина тушеная 97,5% мяса Наше всё 338г",229.98
Виноградные листья Nestos 450г,469.98
Говядина тушеная Ратимир 325г,159.98
Горошек Фрау Марта 420г,126.98
Говядина тушеная Кусковая ЭТО 338г,48.99
Капуста квашеная Соленья ДВ,199.99
Капуста квашеная Лазовские продукты,209.99
Говядина тушеная кусковая Елецкий 340г,49.98
Говядина тушеная ГОСТ Ратимир 338г,196.98
Салат Кимчи слабоострый Koyori 300г,179.99
Печень минтая натуральная Камчаттралфлот 185г,239.98
Огурцы соленые Соленья ДВ,199.99
Говядина тушеная Орский МК 338г,179.98
Говядина тушеная Госрезерв Черепановский 338г,149.98
Грибы острые КНР 350г,99.99
Кукуруза Vernet 425г,89.98
Корнишоны маринованные с луком Золотая Долина 500мл,139.98
Паштет белый нут Perva 100г,89.98
Огурцы соленые кошерные Vegda product 580г,249.98
Огурцы соленые Лазовские продукты,189.99
Тунец кусочки в собственном соку Самбери 185г,177.79
Капуста белокочанная провансаль Соленья ДВ 400г,159.99
Горошек Vernet 425мл,89.98
Салат ДВ с овощами в томатном соке Всегда Добрый день 220г,56.99
Икра из кабачков Угощение Славянки 545г,119.98
Фасоль белая в томатном соусе Самбери 425мл,99.99
Говядина тушеная высший сорт ГОСТ Семейный бюджет 500г,249.98
Тунец рубленый в собственном соку Самбери 185г,154.79
Сайра натуральная Вианг 230г,149.98
Папоротник Орляк соленый 650г,139.99
Огурцы соленые ИП Павлова 600г,159.99
Говядина тушеная Слава ГОСТ Орск 338г,179.98
Сайра тихоокеанская натуральная Доброфлот 245г,229.98
Корнишоны маринованные с чесноком Золотая Долина 500мл,139.98
Перец Халапеньо зеленый резаный маринованный Mikado 370мл,179.98
Чипсы Lay's сметана/зелень 225г,229.98
Арахис Джаз жареный соленый 150г,129.98
Арахис жареный соленый Джаз 40г,34.98
Чипсы Naturals чеснок/зелень 110г,204.96
Чипсы Yam Chip оригинальные 90г,87.77
Чипсы Yam Chip говядина с черным перцем 90г,87.77
Камбала филе кусочки сушеная Дальпико 40г,159.96
Рыбка янтарная солено-сушеная с перцем Донской рыбокомбинат,1049.98
Курица сушенная Снекер 50г,147.98
Чипсы Happy Nachos кукурузные с сыром 150г,119.98
Индейка сушенная Снекер 50г,147.98
Чипсы Naturals с морской солью и перцем 100г,204.96
Чипсы Naturals пармезан 100г,204.96
Сухарики 3 корочки курица/соус терияки 60г,49.96
Миндаль Camel жареный со вкусом копчения 40г,144.96
Минтай сушеный Дальпико-Рыбсервис 50г,124.98
Арахис Camel жареный подсоленный 40г,74.98
Чипсы Naturals паприка 100г,204.96
Арахис жареный со специями 150г,199.98
Фисташки Джаз 130г,379.98
Колбаски Пиколини сырокопченые со вкусом чеснока 50г,87.96
Сухарики Воронцовские холодец/хрен 80г,53.98
Чипсы Lay's из печи Нежный сыр/зелень 85г,119.96
Чипсы Чидо палочки кукурузные креветка 40г,87.97
Чипсы Lay's сметана и зелень 50г,68.98
Чипсы Naturals классик 100г,204.96
Чипсы Доширак краб 50г,79.98
Кешью Camel жареный подсоленный 40г,169.77
Арахис жаренный соленый Караван орехов,649.98
Чипсы мясные Дымов Классические свинина 25г,87.96
Сухарики Хрусteam багет сырное ассорти 60г,68.98
Фисташки Джаз 70г,219.98
Фисташки Джаз 40г,129.98
Колбаски Пиколини сырокопченые со вкусом бекона 50г,87.96
Гренки Воронцовские чеснок 60г,49.98
Морская капуста хрустящая SeiYo 4г,29.99
Сухарики ржаные гренки Клины холодец с хреном 130г,77.98
Чипсы Лейз 81г Зеленый Лук,119.98
Сухарики Хрусteam багет томат и зелень 60г,68.98
Фисташки Beerka 80г,149.98
Арахис жареный соленый + Гренки Бородинские холодец с хреном 100г,54.98
Чипсы Читос 50г сыр,64.99
Кальмар солено-сушеная стружка Донской рыбокомбинат,1199.78
Чипсы Лейз 81г  Сыр,119.98
Чипсы MiniFree луковые кольца/сметана 45г,44.97
Арахис жареный соленый + Сухарики бекон 100г,54.98
Чипсы SeiYo сметана/лук 45г,79.99
Гренки бородинские BEERka чеснок и укроп со сметанным соусом 60г,54.98
Сухари ржаные Клины со вкусом копченой колбаски 40г,18.98
Чипсы Lay's краб 50г,68.98
Чипсы Lay's из печи Сметана/Ароматные Травы 85г,119.96
Минтай вяленый филе Дальпико 50г,117.98
Чипсы Happy Nachos кукурузные Барбекю 150г,119.98
Чипсы SeiYo сыр 45г,79.99
Чипсы SeiYo томат 45г,79.99
Чипсы Московский Картофель Рифленые лосось 150г,89.99
Чипсы Читос кетчуп 50г,64.99
Сухарики ржаные гренки Клины телятина гриль 130г,77.98
Чипсы SeiYo чили 45г,79.99
Свинина сушеная Снекер 50г,147.98
Чипсы Lay's Stax Пикантная паприка 140г,229.99
Сухарики Воронцовские белые грибы 80г,53.98
Гренки ГрызLOVE ЭКО Зерновые Прованские травы 80г,79.98
Чипсы Лейз 81г Бекон,119.98
Чипсы SeiYo барбекю 110г,129.99
Камбала солено-сушеная Дальпико 100г,159.96
Фисташки Camel печеные подсоленные 40г,169.77
Чипсы Чидо палочки кукурузные острый сыр 40г,87.97
Чипсы Лейз 81г Рифленые Паприка,119.98
Чипсы Lay's Рифленые Паприка 225г,229.98
Сухарики Воронцовские шашлык 80г,53.98
Колбаски Пиколини сырокопченые со вкусом Хамона 50г,87.96
Чипсы Бульба Chips сметана и лук 75г,77.98
Сухарики Кириешки холодец с хреном и горчица 60г,49.88
Чипсы SeiYo сметана/лук 110г,129.99
Сухарики Хрусteam багет краб 60г,68.98
Фисташки Camel печеные подсоленные 150г,599.96
Чипсы SeiYo сыр 110г,129.99
Мидии солено/сушеные Дальпико 50г,139.98
Чипсы Lay's из печи Лисички в сметане 85г,119.96
Чипсы Помстикс соломка паприка 100г,159.98
Чипсы Binggrae краб 130г,139.98
Чипсы Naturals соус песто 100г,204.96
Гренки Хлебарики бородинские/чеснок с соусом чесночный 70г,54.98
Чипсы Лейз 81г Рифленые Лобстер,119.98
Чипсы Лейз 81г Краб,119.98
Сухари ржаные Гренки Клины со вкусом аджики 130г,77.98
Сухарики Кириешки ветчина и сыр 100г,44.98
Чипсы Помстикс соломка с солью 100г,159.98
Чипсы SeiYo барбекю 45г,79.99
Чипсы Лейз 81г с Солью,119.98
Сухарики Кириешки холодец и хрен 100г,44.98
Сухарики Кириешки бекон 100г,44.98
Кальмар щупальца сушеные 40г Шкипер Брукк,214.98
Чипсы SeiYo оригинальные 110г,129.99
Чипсы Лейз 81г Сметана Зелень,119.98
Чипсы SeiYo оригинальные 45г,79.99
Чипсы Binggrae креветка 50г,49.99
Чипсы Binggrae Зяки-Зяки 80г,99.98
Сухарики Три корочки малосольные огурцы/соус тар-тар 60г,49.96
Хлеб Бородино с тмином 250 г,39.90
Капуста маринованная с морковью ФК,260
