Стейк из мраморной говядины Чак ролл Matured Beef Мираторг 650г,1069.98
Стейк Рамп Мираторг 480г,899.79
Стейк Пиканья из мраморной говядины BlackAngus Мираторг 325г,729.96
Стейк Техас мраморная говядина Мираторг 300г,549.68
Свинина на кости корейка экстра замороженная Мясной ряд,399.96
Яйцо куриное Белореченское С1 15шт пленка,149.99
Стейк Мачете из мраморной говядины МЯSOЕТ 200г охл,589.98
Стейк Рибай из говядины Родные места 320г,619.89
"Тушка цыпленка,корнишон КФХ Дорофеев 500г",369.87
Грудная кость куриная Амурский Бройлер,94.99
Стейк Рамп из мраморной говядины МЯSOЕТ 200г,599.87
Печень говяжья замороженная Ратимир,369.99
Головы ЦБ 1кг пакет Амурский бройлер,99.97
Печень свиная замороженная Ратимир,199.99
Стейк Ранчо из говядины бескостные Родные места 250г,498.98
Стейк Топ-Блейд мраморная говядина Праймбиф 400г,1399.78
Тушка кролика Россия,639.77
Стейк Пиканья из мраморной говядины МЯSOЕТ 200г,599.99
Стейк Фермер из говядины бескостные Родные места 250г,449.89
Стейк Бавет из мраморной говядины МЯSOЕТ 400г,1099.99
Стейк Нью-Йорк из мраморной говядины МЯSOЕТ 200г,849.69
Свинина без кости шея экстра Мясной Ряд,489.79
Стейк ЧакАйРолл мраморная говядина Праймбиф 400г,1049.99
Стейк Рамп мраморная говядина Праймбиф 400г,799.79
Яйцо перепелиное 20шт Березовка,159.99
Стейк Рибай из мраморной говядины МЯSOЕТ 200г,999.97
Стейк Денвер из мраморной говядины МЯSOЕТ 200г,699.99
Яйцо перепелиное 10шт,99.98
Лопатка свиная в маринаде СловоМясника,469.96
Стейк Яблочко мраморная говядина Праймбиф 400г,999.97
Свинина шея без кости охлажденная Слово мясника,529.96
Вегас стейк из мраморной говядины Мираторг 480г,949.97
Цыпленок Халяль 1 сорт ALFOOR,269.78
Цыпленок Халяль 1сорт Равис,257.97
Фарш Пикантный из печени Мясное дело 800г,219.68
Стейк Топ-Сирлойн мраморная говядина Праймбиф 400г,999.99
Ребра бараньи на кости Халяль Россия,699.96
Цыпленок 2 категория замороженный пакет Приосколье,249.68
Окорочок утенка Улыбино,679.89
Бедро куриное Михайловский бройлер подложка,249.69
Яйцо куриное С0 15шт Птицефабрика Заря,169.99
Свинина без кости корейка замороженная Слово Мясника,399.99
Шейка баранья Эколь,789.78
Желудки куриные охлажденные Амурский бройлер,369.78
Филе индейки малое Индилайт 1кг,739.97
Филе грудки куриное Михайловский бройлер подложка,399.99
Крыло куриное охлажденная на подложке Дальневост птица,329.77
Ножки свиные охл.,89.90
Лопатка баранья без кости в сетке Халяль Россия,1049.96
Грудка куриная Михайловский бройлер подложка,339.97
Свинина бескостный окорок охлажденный Слово мясника,419.68
Гуляш из говядины Халяль Мясо Есть,919.87
Филе грудки индейки Индилайт 1кг,739.87
Цыпленок 1 категория Халял Приосколье,239.88
Фарш домашний замороженный Карина 500г,169.98
Крыло куриное замороженное Амурский Бройлер,299.78
Окорочок куриный Михайловский бройлер подложка,279.99
Стейк Паризьен из мраморной говядины Black Angus Мираторг 290г,599.79
Шея свиная Викинг,489.88
Набор куриный для супа Михайловский бройлер подложка,129.89
Яйцо куриное С1 Белореченское 30шт,289.98
Свинина без кости карбонад экстра Мясной Ряд,449.88
Стейк Топ Блейд мраморная говядина Black Angus Мираторг 460г,1099.98
Голяшка говяжья без кости Оренбив,709.69
Грудинка баранья Эколь,329.99
Фарш домашний замороженный Карина 1кг,329.99
Баранина для плова Халяль Россия,699.99
Набор для первых блюд Амурский Бройлер,99.99
Бефстроганов из говядины 400г Надежда-95,499.87
Печень индейки Краснобор,399.99
Купаты Французские свинина/сыр Охотно 400г,249.69
Тушка утенка замороженная Улыбино,379.97
Крыло куриное замороженное,319.89
Стейк Мачете в маринаде Открытый огонь 200г,469.67
Шашлык куриный Аппетитный без специй бескостный Амурский Бройлер подложка,499.97
Голень ягнёнка на кости Мясники Отара,749.98
Яйцо куриное С0 Белореченское 15шт,177.99
Эскалоп свиной без кости Ратимир,469.98
Половинка цыпленка 1 категория Амурский Бройлер,309.99
Свинина без кости лопатка Слово мясника,379.99
Фарш куриный Домоседка 500г,119.79
Фарш куриный Карина 500г,169.99
Шницель из индейки Индилайт 1кг,709.69
Сердце куриное охлажденное Амурский бройлер,529.96
Яйцо перепелиное копченое Молодецкие 20шт,357.98
Печень куриная охлажденная Амурский бройлер,309.99
Сердце куриное подложка Приосколье,319.69
Набор для супа куриный Михайловский бройлер подложка,139.68
Голень индейки Краснобор,289.68
Фарш Смешанный баранина/говядина Эколь,429.79
Стейк грудки индейки Индилайт 1кг,749.79
Цыпленок 1с Байсад фирменный пакет,199.87
Шеи цыпленка-бройлера Амурский бройлер 1кг,129.68
Ребрышки говяжьи Конфи Россия,599.96
Колбаски свиные для жарки и гриля Классические Доброе дело 350г,279.87
Набор для тушения охлаждённый Амурский Бройлер,119.99
Желудки куриные замороженные Приосколье,179.96
Фарш домашний ГОСТ 600г Ратимир,369.98
Цыпленок 1 категория охлажденный Амурский Бройлер,240.98
Свинина без кости лопаточная часть экстра замороженная Мясной ряд,369.99
Фарш говяжий замороженный 500г Карина,172.79
Голень куриная охлажденная на подложке Дальневосточная птица,299.99
Рагу свиное Слово Мясника,169.99
Бедро бескостное полуфабрикат из мяса птицы Амурский Бройлер,499.77
Цыпленок 1 сорт Михайловский бройлер,198.99
Стейк Рибай из говядины толстый край Открытый огонь 250г,649.69
Стейк Минутка из мраморной говядины BlackAngus Мираторг 190г,389.87
Голень индейки замороженная,259.99
Свинина без кости шея замороженная в/у Слово мясника,531.97
Цыпленок 1 сорт Михайловский бройлер подложка,289.88
Грудка куриная охлажденная Амурский Бройлер,200
Крыло куриное охлажденное Амурский Бройлер,339.89
Говядина без кости внутренняя часть тазобедренного отруба,699.99
Фарш Столичный из индейки Индилайт 900г,169.98
Грудка куриная охлажденная на подложке Михайловский бройлер,349.89
Яйцо куриное С1 Белореченское Домашнее 10шт,102.98
Рагу баранье Халяль Мясо Есть,149.79
Голень индейки Индилайт,299.87
"Фарш ""Особенный"" рубленный охлаждённый Амурский бройлер",439.89
Яйцо куриное С1 10шт Племптицезавод,99.98
Голень куриная охлажденная Амурский Бройлер,296.98
Бедро куринное охлажденная на подложке Дальневосточная птица,279.89
Ребро свиное с корейки Слово Мясника,439.77
Свинина на кости окорок экстра Мясной ряд,339.99
Свинина без кости окорок экстра замороженная Мясной ряд,398.98
Свинина без кости замороженная окорок в/у Слово мясника,429.99
Крыло куриное замороженное на подложке Приосколье,259.79
Филе бедра индейки Индилайт 1кг,769.67
Филе цыпленка замороженное Амурский Бройлер,429.98
Яйцо куриное С1 30шт Племптицезавод,269.99
Свинина без кости мясо котлетное замороженное Слово Мясника,399.79
Грудка куриная замороженная на подложке Приосколье,309.88
Печень куриная замороженная на подложка Приосколье,209.99
Яйцо куриное копченое Молодецкие 4шт,199.98
Яйцо куриное С0 10шт Племптицезавод,109.98
Филе грудки куриное охлажденное без кожи на подложке Дальневосточная птица,489.67
"Свинина (голяшка, рулька) охлаждённая",279.90
Яйцо куриное С1 20шт Местное,229.99
Тушка утенка 1с Озерка,329.67
Яйцо куриное столовое отборное 20шт тепличное Племптицезавод,217.99
Цыпленок 1кат замороженный пакет Приосколье,193.85
Филей лопаточной части говядины без кости Оренбив,789.96
Фарш говяжий 600г Ратимир,389.78
Голень куриная замороженная на подложке Приосколье,208.98
Окорочок бескостный подложка Приосколье,399.99
Баранина для плова Эколь,429.96
Шашлык свиной по-Кавказски Слово Мясника ведро,429.98
Колбаски для жарки и гриля с паприкой Доброе дело 350г,279.87
Бедро куриное охлажденное Амурский Бройлер,296.98
Печень говяжья замороженная фасованная,293.98
Окорочка куриные (четвертина) фасованные Россия,225.98
Хрящи свиные на кости,149.78
Бедро куриное замороженное,239.99
Яйцо куриное СО 10шт Местное,114.99
Голень куриная замороженная,259.98
Бедро куриное замороженное на подложке Приосколье,191.98
Филе грудки куриное охлажденное Амурский Бройлер,449.97
Филе грудки куриное замороженное на подложке Приосколье,303.79
Говядина бескостная экстра лопаточная часть Ратимир,749.97
Варенье Ежевика экстра Noyan 450г,299.98
Джем Айва Noyan 425г,199.98
Варенье Арбуз экстра Noyan 450г,299.98
Мед липовый Сота 300г,259.98
Суфле медовое Медовый дом маракуйя 250г,229.98
Варенье Сава облепиха 300г,169.98
Варенье персиковое домашнее Вологодское 370г,227.98
Джем клубника Делфур 284г,389.98
Варенье малиновое Вологодское 370г,269.98
Варенье малиновое домашнее Спасский 420г,179.98
Сироп Шиповниковый BioNergy 200мл,149.98
Мёд цветочный Медовая семья 150г,109.98
Варенье абрикосовое Вологодское 370г,227.98
Сироп черносмородиновый Lesnika 300мл,165.98
Джем вишня Ратибор 360г,169.98
Мед цветочный Сота 300г,249.98
Мёд гречишный призма 350г Башкирские пасеки,299.98
Мед Алтайцвет Горный Избранное 200г,249.98
Варенье вишнёвое без косточки Лукашинские 450г,259.98
Варенье чёрносмородиновое Лукашинские 450г,259.98
Джем малина 400г Махеев,259.98
Джем ананас-манго Делфур 284г,389.98
Мед липовый с лимонником Lesnika 250г,199.98
Джем St.Dalfour манго/маракуйя 284г,389.98
Мёдовый набор липа/цветочный/гречичный Башкирские пасеки 450г,599.98
Мед липовый с пыльцой Lesnika 250г,199.98
Варенье крыжовниковое Спасский 420г,179.98
Сироп шиповник Lesnika 300мл,165.98
Джем клюква/черника St.Dalfour 284г,389.98
Мед таёжный Lesnika 250г,149.98
Джем St.Dalfour яблоко/корица 284г,389.98
Мёд липовый призма 350г Башкирские пасеки,459.98
Джем вишня Абрико 270г,84.98
Мёд цветочный призма 350г Башкирские пасеки,299.98
Мед липовый с женьшенем Lesnika 250г,199.98
Варенье абрикосовое Лукашинские 450г,259.98
Мед цветочный с прополисом Берестов А.С. 200г,299.98
Джем Сава вишневый с кусочками 300г,129.98
Сироп шиповник Lesnika 500мл,239.98
Джем ежевика St.Dalfour 284г,389.98
Джем Terra Frutta апельсин/киви 200г,89.99
Джем персик Делфур 284г,389.98
Джем слива Мирабелла St.Dalfour 284г,389.98
Варенье Сава жимолость 300г,219.98
Мёд липовый в соте Избранное Берестов А.С. 200г,449.98
Мед гречишный Lesnika 250г,149.98
Сироп клюква Lesnika 300мл,165.98
Джем Terra Frutta апельсин/лимон/имбирь 200г,149.98
Ягода протертая с сахаром черника Сава 280г,109.98
Джем клубника/ревень St.Dalfour 284г,389.98
Мед гречишный Медовая семья 400г,219.98
Сироп облепиха Lesnika 300мл,165.98
Мёд гречишный Медовая семья 1000г,449.98
Варенье клубничное Лукашинские 450г,259.98
Джем малина St.Dalfour 284г,389.98
Мёд цветочный 1кг,449.98
Мед липовый Lesnika 250г,159.98
Мед таёжный Lesnika 450г,269.98
Ягода протертая с сахаром брусника Сава 280г,109.98
Сироп черника Lesnika 300мл,165.98
Варенье персиковое Лукашинские 450г,259.98
Джем черника St.Dalfour 284г,389.98
Джем груша и банан с ванилью Махеев 300г,118.98
Варенье Сава клубничное 300г,189.98
Джем абрикос Ратибор 360г,169.98
Мёд набор Башкирские пасеки 5*40г,459.98
Джем кумкват St.Dalfour 284г,389.98
Джем малина/гранат St.Dalfour 284г,389.98
Джем Персик и Манго 400г Махеев,229.98
Повидло вишнево-яблочное Мама сказала! 1кг,146.99
Ягода протертая с сахаром земляника Сава 280г,109.98
Варенье малина Лукашинские 450г,379.89
Джем сливовый Махеев 300г,118.98
Джем клубника Абрико 330г,84.98
Мёд цветочный/грецкий орех Сотка 220г Башкирские пасеки,299.98
Повидло клубнично-яблочное Мама сказала! 1кг,146.99
Джем Terra Frutta апельсин/манго 200г,149.98
Молоко кокосовое Chaokoh 65мл,77.89
Джем черная смородина Махеев 300г,129.98
Джем вишневый Махеев 300г,129.98
Джем апельсин Делфур 284г,389.98
Повидло яблочное Мама сказала! 630г,107.99
Джем клубника Махеев 300г,115.98
Топпинг Мягкая Карамель Махеев 300г,169.98
Джем клубника 400г ст/б Махеев,229.98
Сироп Кедровый Бионерджи 200мл,149.98
Повидло абрикосово-яблочное Мама сказала! 1кг,146.99
Мед липовый Медовая семья 150г,119.98
Джем малина Махеев 300г,142.98
Мед таежный Медовая семья 150г,109.98
Сироп кленовый Maple Joe 189мл,528.68
Повидло яблочное Мама сказала! 1кг,146.99
Мёд липовый Медовая семья 1000г,479.99
Джем Сава абрикосовый с кусочками 300г,129.98
Молоко кокосовое Ampawa 17% 400г,199.89
Молоко кокосовое 60% Aroy-d 400мл,299.89
Лампа Gauss светодиодная шар 12Вт Е27 теплый свет,289.99
Лампа Gauss светодиодная А67 25ВТ Е27 холодный свет,399.99
Лампа Gauss светодиодная шар 12Вт Е27 холодный свет,289.99
Элемент питания Duracell Basic ААА 1.5V LR03 2шт,199.67
Лампа InHome светодиодная A60 15Вт Е27 холодный свет,129.87
Лампа InHome светодиодная JCDR 11Вт GU5.3 холодный свет,149.98
Лампа ОНЛАЙТ светодиодная A55 10Вт Е27 холодный свет,69.99
Лампа ЭРА ECO светодиодная свеча 8Вт Е27 теплый свет,104.99
"Лампа Gauss светодиодная шар 6,5Вт Е27 теплый свет",159.87
Лампа ЭРА светодиодная А60 11Вт Е27 теплый свет,149.99
Лампа Gauss светодиодная А67 25ВТ Е27 теплый свет,399.99
Лампа Эра галогенная GY6.35 JCD 35W 230V,79.99
Элемент питания Duracell Basic AA 1.5V LR6 2шт,199.67
Лампа ЭРА светодиодная А60 15Вт Е27 теплый свет,199.99
Лампа InHome светодиодная A60 8Вт Е27 холодный свет,89.67
Лампа Эра галогенная G4 JCD 40W 230V,79.99
Лампа Эра галогенная GU5.3 JCDR (MR16) 35W 230V,99.99
Лампа Gauss светодиодная шар 15Вт Е27 теплый свет,269.99
Лампа ЭРА ECO светодиодная шар 8Вт Е14 холодный свет,104.99
Лампа ЭРА светодиодная свеча 11Вт Е27 холодный свет,199.99
Лампа ЭРА ECO светодиодная свеча 8Вт Е14 теплый свет,104.99
Лампа Эра галогенная GY6.35 JC 35Вт 12V,69.99
Лампа ЭРА светодиодная А60 13Вт Е27 теплый свет,169.99
"Лампа Gauss светодиодная шар 6,5Вт Е27 холодный свет",159.87
Лампа ЭРА светодиодная свеча 11Вт Е27 теплый свет,199.99
Лампа InHome светодиодная JC 3Вт G4 холодный свет,169.67
Лампа InHome светодиодная HP-PRO 30Вт Е27 холодный свет,319.88
Лампа ЭРА ECO светодиодная свеча 8Вт Е27 холодный свет,104.99
Элемент питания Duracell 12V MN27 1шт,239.96
Лампа Эра галогенная G4 JC 20W 12V,54.99
Лампа InHome светодиодная шар 8Вт Е27 теплый свет,99.79
Лампа InHome светодиодная свеча 11Вт Е14 холодный свет,129.78
Лампа ЭРА ECO светодиодная шар 8Вт Е14 теплый свет,104.99
Лампа ЭРА ECO светодиодная свеча 8Вт Е14 холодный свет,104.99
Элемент питания Duracell Basic 9V 6LR61 1шт,449.87
Элемент питания Duracell 1.5V LR44 2шт,189.96
Лампа InHome светодиодная шар 6Вт Е14 теплый свет,89.87
Лампа ЭРА светодиодная А60 13Вт Е27 холодный свет,169.99
Лампа ЭРА светодиодная А60 11Вт Е27 холодный свет,149.99
Лампа ЭРА шар 60Вт Е27 прозрачная,39.99
Элемент питания Duracell Ultra Power АА LR6 4шт,409.99
Лампа InHome светодиодная A60 10Вт Е27 холодный свет,99.99
Лампа ЭРА светодиодная свеча 11Вт Е14 теплый свет,199.99
Лампа InHome светодиодная JCDR 11Вт GU5.3 теплый свет,149.98
Лампа ЭРА светодиодная шар 7Вт Е27 теплый свет,149.99
Лампа ЭРА шар 40Вт Е27 прозрачная,39.99
"Лампа Gauss светодиодная свеча 9,5Вт Е14 теплый свет",249.99
Лампа ЭРА светодиодная свеча 7Вт Е27 теплый свет,149.99
Лампа ЭРА светодиодная свеча 7Вт Е14 теплый свет,149.99
Лампа ЭРА свеча 60Вт Е14 прозрачная,39.99
Лампа InHome светодиодная JCD 3Вт G9 холодный свет,179.98
"Лампа InHome светодиодная JC 1,5Вт G4 холодный свет",129.78
Лампа ЭРА светодиодная А65 19Вт Е27 теплый свет,239.99
Лампа ЭРА светодиодная F-LED свеча 5Вт Е14 теплый свет,169.99
Элемент питания Duracell 12V MN21 1шт,169.88
Лампа ЭРА светодиодная JCD 5Вт G9 теплый свет,239.99
Лампа ЭРА светодиодная А60 15Вт Е27 холодный свет,199.99
Лампа ЭРА светодиодная шар 11Вт Е14 холодный свет,199.99
Лампа ЭРА светодиодная свеча 11Вт Е14 холодный свет,199.99
Лампа ЭРА свеча 60Вт Е27 прозрачная,39.99
Лампа ЭРА светодиодная MR16 8Вт GU5.3 теплый свет,104.99
Лампа InHome светодиодная шар 6Вт Е14 холодный свет,89.87
Лампа ЭРА светодиодная свеча 7Вт Е27 холодный свет,149.99
Лампа ЭРА светодиодная свеча 7Вт Е14 холодный свет,149.99
Элемент питания Duracell Specialty 2025 2шт,369.78
Элемент питания Duracell UltraPower ААА LR03 4шт,409.99
Удлинитель ЭРА 3гн 10м с заземлением,869.99
Лампа InHome светодиодная A60 8Вт Е27 теплый свет,89.67
Лампа ЭРА светодиодная шар 7Вт Е27 холодный свет,149.99
Лампа ЭРА светодиодная А65 19Вт Е27 холодный свет,239.99
Лампа Эра галогенная GU10 JCDR 35Вт 230V,129.99
Лампа InHome светодиодная JCD 5Вт G9 холодный свет,179.98
Лампа InHome светодиодная JCDR 4Вт GU5.3 теплый свет,99.98
Элемент питания Duracell UltraPower АА LR6 2шт,219.79
Лампа Эра галогенная G9 JCD 40 230V Cl,79.99
