Клюшка хоккейная детская мини прямой крюк 70см,80
Ледянка мягкая круглая Летяшка 33х33см,40
Ледянка Snow Assss,40
Клюшка детская STC прямая,150
Клюшка взрослая STC левая,250
Тюбинг с ручками 65см,350
Пакет крафт 43х32х17см с плоской ручкой,19.99
Сумка Эко д/покупок 35х44х12см Самбери зеленый,49.99
Пакет-майка 30х15х54см биоразлагаемая 25шт,99.99
Пакеты универсальные 22х30 80шт Всегда Добрый День,39.99
Пакеты для замораживания 25х32 30шт CELESTA,59.97
Пакеты для льда 240 кубиков самозакрывающиеся Грифон,89.98
Пакет-майка Самбери 300х550 30мкм белый,6.99
Пакеты для замораживания 25x35см 30шт Самбери,74.99
Пакеты фасовочные Всегда Добрый День 26х35см 500шт,249.98
Пакеты для хранения и замораживания 10шт 15х22см One Time,48.97
Пакеты универсальные Самбери 25х35см 100шт,89.99
Пакеты фасовочные 25х40см 200шт ILO,359.98
Пакеты для запекания 30х40см 4шт Самбери,59.99
Пакет-майка Самбери 400х650 40мкм белый,8.99
Пакеты универсальные Самбери Bio 25х40см 120шт,169.99
Термопакет 2х45см с ручками Самбери,159.98
Пакеты универсальные Самбери 25х35см 300шт,229.99
"Напиток энергетический Adrenaline Rush Juicy 0,449л",174.98
"Напиток энергетический Adrenaline Rush 0,25л",119.98
"Напиток энергетический Adrenaline Rush 0,449л",174.98
Напиток энергетический Drive me Ориджинал 1л,139.98
"Напиток энергетический Red Bull кокос с ягодами 0,25л",129.87
"Напиток энергетический Drive Me Ориджинал 0,449л",84.98
"Напиток энергетический Flash 0,5л",64.98
"Напиток энергетический Red Bull 0,355л",159.98
"Напиток энергетический Red Bull без сахара 0,25л",129.87
"Напиток Bombbar лайм/мята/L-карнитин 0,5л",159.98
"Напиток Bombbar грейпфрут/L-карнитин 0,5л",159.98
"Напиток энергетический Burn оригинальный 0,449л",149.98
"Напиток энергетический Red Bull 0,25л",129.87
"Напиток энергетический Adrenaline Rush Red 0,449л",174.98
"Напиток энергетический Adrenaline Game Fuel 0,449л",174.98
Пиво Hermann muller светлое 0.5л 4%,99.98
"Напиток энергетический Red Bull 0,473л",188.96
"Напиток энергетический Red Bull арбуз 0,25л",129.87
Напиток Тоник 1л классический пэт,64.98
Напиток энергетический Flash 1л,119.98
Напиток Evervess тоник газированный 1л,114.98
"Напиток энергетический Burn темная энергия 0,449л",149.98
Напиток Тоник 1л Лимон пэт,64.98
Грунт универсальный Народный грунт 5л,67.99
Аэрозоль от моли Армоль 140см3,149.98
Перчатки садовые ХБ черные 10 класс 80г двойные,77.98
Гель от тараканов муравьев Раптор 75мл,399.98
Перчатки садовые ХБ белые 10 класс 40г 10шт,289.98
Перчатки садовые ХБ белые 10 класс 60г Супер Мастер,49.98
Перчатки белые ХБ 7 класс 26г Народные,29.89
Удобрение для комнатных растений Бона Форте Здоровье 285мл,177.98
Подвеска от моли Раптор Лаванда подвеска картон,99.98
Черенок деревянный для лопат/вил 40х120см,134.98
Перчатки садовые нейлон цветные 13кл 25г точка,74.98
Пластины от моли Армоль 10шт,69.98
Удобрение для декоративно-цветущих растений Добрая Сила 250мл,109.98
Перчатки черные ХБ 10 класс 40г Стандарт,34.98
Перчатки садовые нитриловые Обливные рМ Pumpkin,99.98
Перчатки садовые полиуретановое покрытие рМ Pumpkin,99.98
Удобрение универсальное Добрая Сила 250мл,109.98
Удобрение для орхидей Бона Форте Здоровье 285мл,177.98
Удобрение для декоративно-лиственных растений Добрая Сила 250мл,109.98
Дихлофос Варан А Универсальный 440мл,149.98
"Субстрат Кактус PROF 2,5л",127.99
Аэрозоль от ползающих и летающих насекомых CombatMultiSpray 400мл,499.98
"Субстрат Туф вулканический 0,5кг",84.99
Секция защита от моли Раптор без запаха,149.96
Перчатки садовые ХБ черные 10 класс Тигр Лайт,34.98
Удобрение для декоративно-лиственных растений Бона Форте 285мл,177.98
Удобрение для комнатных растений Бона Форте Красота 285мл,177.98
Аэрозоль от насекомых Дихлофос Нео 190см3,119.99
Удобрение для орхидей Бона Форте Красота 285мл,177.98
Ловушка от тараканов Тайга клеевая,69.98
"Распылитель ручной 0,5л",119.96
Шпагат полипропиленовый 100м,104.96
Аэрозоль от резистентных тараканов Раптор 430мл,649.96
"Лейка пластик М-пластика 1,5л",199.98
Система ликвидации тараканов Раптор гель + 4ловушки,349.89
Гель от тараканов-муравьев Чистый дом шприц 20г,64.98
Диски-ловушки от тараканов Super Bait Combat 6шт,599.98
Ловушка от тараканов Раптор 6шт,349.89
Аэрозоль от ползающих насекомых Раптор 350мл,399.89
Дренаж керамзит Бона Агро 2л,57.99
Аквафумигатор Раптор система ликвидации насекомых,649.89
Ловушка от тараканов Аргус,49.98
Продукт питьевой овсяный Velle малина 250г,154.99
Молочко Кедровое Сава 200мл,219.99
Батончик глазированный Bombbar Фундучное пралине 40г,99.98
Подушечки хрустящие персик 200г,84.99
Батончик протеиновый глазированный Chikalab Фисташковый крем 60г,164.99
Отруби DiaDar ржаные-Бородинские 200г,54.23
Печенье Protein Rex протеиновое 25% миндаль-лимон 50г,89.99
Батончик глазированный Bombbar Малиновый сорбет 40г,99.98
Леденцы Радоград с прополисом лимон/мёд 32г,99.98
Батончик глазированный Snaq Fabriq Манго/маракуйя 40г,84.97
Леденцы Радоград с прополисом мята/ментол 32г,99.98
Гематоген Витамины плюс 40г,29.99
Батончик глазированный Bombbar Банановый пудинг 40г,99.98
Батончик протеиновый Bombbar Тирамису 60г,139.98
Кисель овсяный Detox Bio Компас здоровья 25г,24.99
Батончик глазированный Bombbar Кокосовый торт 40г,99.98
Леденцы Радоград прополис/шалфей 32г,99.98
Крекер Eco Botanica пищевые волокна/картофель/зелень 175г,109.99
Батончик протеиновый глазированный Chikalab Клубника со сливками 60г,164.99
"Напиток овсяный Nemoloko 3,2% ваниль 1л",139.99
Леденцы Радоград с прополисом облепиха/мед 32г,99.98
Молочко кедровое Сава лайт 500мл,259.99
Шоколад горький Eco Botanica апельсин и витамины 90г,204.97
Молоко кедровое Сава кокос/кешью 200мл,161.99
Фруктоза Novasweet 500г,264.96
Халва подсолнечная с фруктозой в шоколадной глазури 68г,84.98
Печенье Protein Rex протеиновое 25% шоколад-вишня 50г,89.99
Шарики кукурузные Здоровей 30г,89.97
Печенье Bombbar неглазированное Кокос 40г,89.98
Напиток соевый ALPRO банан/витамины/кальций 1л,379.99
Конфеты Петродиет на фруктозе грильяжные 200г,239.99
Молочко кедровое Сава фундук/миндаль 200мл,169.99
Джем на фруктозе брусника Мир здоровья 300г,149.99
Гематоген Русский новый с кедровым орехом 40г,37.96
Батончик протеиновый Bombbar Манго-банан 60г,139.98
Пряник Петродиет Шоколадный на фруктозе 350г,209.89
Каша Худейка Компас Здоровья 250г,137.98
Хлеб вафельный Elizaveta витаминизированный 80г,54.98
Печенье Мария Santiveri без глютена 185г,299.98
Пюре стерилизованное 450г яблоко/персик Будь здоров АВС,99.98
Печенье протеиновое глазированное Chikalab Арахис 60г,159.99
Подушечки хрустящие молочный Каприз 200г,84.99
Шоколад горький Eco Botanica имбирь 90г,204.97
Каша Bionova без сахара овсяная шоколад протеин 40г,49.97
Пюре стерилизованное Будь здоров АВС яблоко-банан 450г,99.98
Батончики Умные сладости без глютен белая глазурь 20г,39.98
Кисель имбирный Detox Bio Компас здоровья 25г,24.99
Шоколад молочный Eco Botanica злаки и витамины 90г,204.97
Заменитель сахара Novasweet 1200 таблеток,209.98
Батончик Protein Bar со вкусом банана 50г,69.99
Пирожное Protein Rex Брауни/вишня 50г,134.96
Батончик Protein Bar со вкусом кокоса 50г,69.99
Батончики Умные сладости б/глютен лесная ягода 20г,39.98
Отруби DiaDar пшеничные хрустящие 200г,54.23
Конфеты Петродиет на сорбите желейные 200г,189.99
Пирожное Protein Rex Брауни 50г,134.96
Батончик глазированный Snaq Fabriq Ананас 40г,84.97
Фруктоза Novasweet 250г,154.96
Корнерсы Dr. Korner с оливковым маслом и розмарином 50г,59.98
Крекер Eco botanica отруби/сладкий перец/зелень 175г,109.99
Пряники Петродиет на фруктозе абрикос 340г,209.89
Шарики рисовые Здоровей 30г,89.97
Сухарики без сахара Клюква 40г,94.97
Лепешка Тарталетка Чудо-хрустяшка 30г,64.67
Напиток овсяный Nemoloko классический лайт 1л,139.99
Печенье неглазированное Вишня Bombbar 40г,89.98
Напиток овсяный Nemoloko фруктовый Экзотик 1л,139.99
Печенье Eco Botanica с бета каротином и курагой 200г,129.99
Напиток соевый Nemoloko 1л,139.99
Отруби пшеничные с брусникой СибТар 200г,54.23
Крем-суп Bionova протеиновый сырный 20г,64.99
Сухарики без сахара Черника 40г,94.97
Пюре стерилизованное Будь здоров АВС яблоко 450г,99.98
Батончик Protein Bar со вкусом карамели 50г,69.99
"Напиток соевый 1,8% 1л фундук Hi",187.97
Каша Bionova без сахара овсяная яблоко протеин 40г,49.97
Шоколад без сахара с тертым миндалем Украли сахар Красный Октябрь 90г,164.99
Батончики Умные сладости без глютена кокос 20г,39.98
Напиток кокосовый Nemoloko 1л,177.99
Напиток миндальный Nemoloko 1л,177.99
Конфеты Нуга Пина Колада на фруктозе 180г,159.88
Заменитель сахара Novasweet 650 таблеток,139.98
Шоколад Молочный 36% какао на стевии 50г,84.79
Корнерсы Dr.Korner с томатом и базиликом 50г,59.98
Батончик глазированный Snaq Fabriq Кокос 40г,84.97
Напиток овсяный Nemoloko классический 1л,134.99
Халва арахисовая с фруктозой в шоколадной глазури 68г,74.96
Батончики Умные сладости без глютена шоколадная глазурь 20г,39.98
Конфитюр без сахара Slim Dream манго 300г,249.96
Пюре яблоко/облепиха Будь здоров АВС 280г,69.98
Пюре стерилизованное Будь здоров АВС яблоко/груша 450г,99.98
Зефир Eco Botanica каркаде/витамины 135г,174.99
Клетчатка пшеничная крупная Компас здоровья 150г,79.79
Напиток гречневый Nemoloko классический 1л,139.99
Стевия Novasweet 200г,619.89
Отруби овсяные Компас здоровья 200г,89.89
Кисель облепиховый Detox Bio Компас здоровья 25г,24.99
Конфитюр без сахара Slim Dream клубника-земляника 300г,249.96
Пастила без сахара Белевская клюква 50г,64.99
Отруби ржаные диетические 180г,64.99
Хлебец протеино-злаковый Protein Rex банан 55г,104.96
Напиток овсяный Nemoloko классический экстралайт 1л,134.99
Корнерсы Dr. Korner с сыром 50г,59.98
Крем-суп Bionova протеиновый шпинат 20г,64.99
Конфитюр без сахара Slim Dream маракуйя 300г,249.96
Напиток рисовый 1л кокос Green Milk,187.97
Напиток рисовый 1л миндаль Barista Green Milk,219.99
Крем-суп Bionova протеиновый томатный 20г,64.99
Шоколад Горький 72% какао на стевии 50г ПВ,84.79
Хлебцы пшенично-ржаные Здоровое Меню 90г,34.96
Крем-суп Bionova протеиновый тыква 20г,64.99
Заменитель сахара №10 FitParad 100 саше,229.98
Кокосовое молоко 60% AROY-D 250мл,229.98
Каша Bionova без сахара овсяная семена чиа протеин 40г,49.97
Печенье овсяное без сахара Искусство Жить 5 злаков 200г,139.97
Пастила без сахара Белевская классическая 50г,64.99
Конфитюр без сахара Slim Dream апельсин 300г,249.96
Печенье овсяное без сахара Искусство Жить классическое 200г,139.97
"Пиво безалкогольное Горьковская пивоварня светлое нефильтрованное 0,33л",99.98
"Напиток пивной Amstel Натур Лайм/Мята безалкогольный 0,43л",74.98
"Напиток пивной Amstel Натур Малина безалкогольный 0,43л",74.98
"Пиво Tsingtao светлое безалкогольное 0,33л",89.98
"Пиво Майзелс Вайс Алькогольфри светлое безалкогольное 0,5л",184.79
"Пиво Балтика №0 безалкогольное лайм 0,33л",67.97
"Пиво Балтика №0 безалкогольное грейпфрут 0,33л",67.97
"Пиво Hite Free светлое безалкогольное 0,355л",94.98
"Напиток пивной безалкогольный Амстел 0% Натур Апельсин/Грейпфрут 0,43л",74.98
"Пиво Stella Artois безалкогольное 0,44л",97.98
"Пиво Bud светлое безалкогольное 0,45л",77.98
"Шампанское Absolute Nature безалкогольное полусладкое 0,75л",299.97
"Напиток пивной ESSA ананас/грейпфрут безалкогольное 0,45л",84.98
"Пиво Балтика №0 пшеничное нефильтрованное безалкогольное 0,45л",69.96
"Напиток Вино безалкогольное Лайт Хаус 0,75л 0,5%",679.87
"Пиво Амстел безалкогольное 0,33л",54.98
"Пиво Сладовар пшеничное безалкогольное светлое 0,5л",79.97
"Пиво Афанасий Марочное светлое безалкогольное 0,5л",99.78
Грибы Белые соленые 360г,479.99
Огурцы соленые СХП Колос,229.99
Огурчики Лукашинские бутербродные по-европейски 670г,269.98
Корнишоны острые Kuhne 530г,549.98
Фасоль печеная в томатном соусе Пиканта 530г,189.98
Брускетта из оливок Каламата и зеленых оливок Delphi 230г,419.98
Шампиньоны резаные с трюфелем Pucci 228мл,359.98
Оливки с косточками черные Каламата Astir 250г,429.98
Индейка курага и грецкий орех Медовый дом 250г,399.89
Капуста белокочанная острая Соленья ДВ 400г,129.99
Оливки с косточкой в оливковом масле Каламата Lelia 275г,419.98
Сельдь тихоокеанская натуральная Делатика 245г,59.98
Оливки с косточкой в рассоле Delphi 350г,298.98
Оливки Delphi маринованные 480г,499.98
Скумбрия с овощным гарниром в томатном соусе За Родину 185г,119.98
Лечо Noyan 560г,239.98
Курица с тыквой Медовый дом 250г,399.89
Оливки с анчоусом Bonduelle 314г,219.98
Оливки с лимоном Bonduelle 314г,219.98
Оливки с миндалем Delphi 350г,429.98
Перец острый в томатной мякоти Лукашинские 670г,219.98
Оливки с тунцом Maestro de Oliva 300г,189.99
Фасоль белая в томатном соусе Bonduelle 425мл,109.98
Окунь речной томат и каперсы Медовый дом 250г,399.89
Кролик с можжевеловой ягодой Медовый дом 250г,399.89
Каша гречневая с говядиной Бурятмясопром 340г,119.98
Салат Кактуги из редьки Koyori 300г,179.99
Икра баклажановая Noyan 370г,189.98
Баклажаны на гриле Pucci 314мл,329.98
Оливки со сладким перцем Bonduelle 314мл,219.98
Артишоки La Rambla 415г,439.98
Фасоль гигантская запечённая с овощами Ресторация Обломов 420г,196.98
Лечо Bonduelle 500мл,219.98
Мясо утки Охота МКК Балтийский 325г,176.98
Артишоки целые Iposea 290г,399.98
Оливки с каперсом Iberica 300г,189.99
Оливки без косточки Maestro de Oliva 175г,149.98
Томаты вяленые по-Мексикански Brand Oil 250г,229.98
Карп зеркальный с грецким орехом и изюмом Медовый дом 250г,399.89
Огурцы маринованные 6-9см Bonduelle 680г,249.98
Оливки с косточкой ассорти Каламон Lelia 110г,129.98
Салат Кимчи слабоострый Koyori 500г,289.99
Оливки с косточкой Maestro de Oliva 300г,229.98
Ассорти из оливок традиционное Astir 250г,449.98
Ассорти маринованное кабачки/черри/огурцы Меленъ 900г,189.98
Оливки фаршированные голубым сыром Bonduelle 314г,219.98
Оливки зеленые с косточкой Arbeqvina La Rambla 370г,249.98
Маслины Чика с косточкой Iberica 200г,189.98
Маслины натуральные с косточкой в рассоле DELPHI 350г,389.98
Оливки с лимоном Maestro de Oliva 300г,189.99
Фасоль красная Барбекю Bonduelle 350мл,169.98
Мясо индейки филе Хохлома Балтийский МКК 325г,198.98
Оливки с косточкой Всегда Добрый День 300мл,75.98
Фасоль белая в собственном соку Bonduelle 425г,129.98
Ассорти из оливок пикантное Astir 250г,459.98
Мясо лося Охота Балтийский МКК 325г,249.98
Опята маринованные Самбери 580мл,289.99
Каша гречневая со свининой по-домашнему Губернаторская Главпродукт 340г,99.98
Оливки с сыром Maestro de Oliva 300г,189.99
Артишоки маринованные La Rambla 415г,439.98
Чеснок Экопродукт маринованный 260г,189.98
Огурцы Bonduelle 3-6см 540г,239.98
Шампиньоны маринованные Самбери 580мл,269.99
Каша перловая с говядиной Премиум ГОСТ Орский МК 250г,129.98
Тунец кусочки в масле Фортуна Мистраль 185г,229.98
Каша гречневая с говядиной по-домашнему Губернаторская Главпродукт 340г,99.98
Огурцы с перцем Sonna Mera 720мл,239.98
Салат с тунцом/нут/овощи Fortuna 160г,219.98
Фасоль красная в соусе чили Bonduelle 425мл,139.98
Тунец в оливковом масле Iberica 160г,359.98
Килька неразделанная в томатном соусе За Родину 240г,74.98
Перец зеленый маринованный Delphi 320г,319.98
Горошек Bonduelle 530г,219.98
Шампиньоны резаные отборные Самбери 425мл,119.99
Грибы лисички маринованные Лукашинские 340г,349.98
Оливки с сушенными томатами Delphi 350г,429.98
Томаты вяленые по-Восточному Brand Oil 250г,229.98
Килька с овощами по-гавайски За Родину 240г,87.98
Закуска из баклажанов с печеным перчиком Ресторация Обломов 420г,169.98
Баранина тушеная высший сорт ГОСТ Мясной завод Алтая 338г,209.98
Оливки микс Bellа Contadina 290г,349.98
Лучок Kuhne серебристый маринованный 170г,229.98
Огурчики Лукашинские по-старорусски с зеленью и дубовым листом 670г,199.98
Оливки зеленые крупные с косточкой Pucci 310г,289.98
Имбирь маринованный Экстра SanBonsai 300г,129.98
Грибы Шиитаке маринованные КФХ Федорович 250г,149.99
Оливки целые Iposea 290г,199.98
Помидоры соленые Соленья ДВ 600г,149.99
Имбирь маринованный 300г КНР,69.99
Оливки креветка Maestro de Oliva 300г,189.99
Маслины без косточек ITLV 170г,129.98
Оливки с прованскими травами Iberica 70г,189.98
Каша рисовая с говядиной Премиум ГОСТ Орский МК 250г,129.98
Перец Iberica острый Piri-Piri консервированный 106г,156.98
Фасоль белая Дижонская Фрау Марта 310г,106.98
Сельдь тихоокеанская натуральная НРК 250г,69.98
Сладкий перец на гриле Pucci 314мл,319.98
Каша перловая с говядиной Бурятмясопром 340г,119.98
Каша гречневая с говядиной Премиум ГОСТ Орский МК 250г,129.98
